{
  "$schema": "https://json-schema.org/draft/2020-12/schema",
  "title": "A2A Role Preset",
  "type": "object",
  "required": ["backend", "model", "description", "systemPrompt", "skills"],
  "additionalProperties": false,
  "properties": {
    "$schema": { "type": "string" },
    "backend": {
      "enum": ["claude", "ollama", "claude-code"],
      "description": "Which inference backend handles this role."
    },
    "model": {
      "type": "string",
      "description": "Backend-specific model identifier (e.g. 'claude-sonnet-4-6' or 'gemma4:e4b')."
    },
    "description": {
      "type": "string",
      "description": "One-sentence summary shown to peer agents in list_agents."
    },
    "systemPrompt": {
      "type": "string",
      "description": "System prompt prepended to every conversation."
    },
    "skills": {
      "type": "array",
      "description": "Capabilities surfaced via the Agent Card. Peers read these to decide routing.",
      "items": {
        "type": "object",
        "required": ["id", "name", "description"],
        "properties": {
          "id": { "type": "string" },
          "name": { "type": "string" },
          "description": { "type": "string" }
        },
        "additionalProperties": false
      }
    },
    "toolCapable": {
      "type": "boolean",
      "description": "Set to true if the model supports function calling. Claude is always true; Ollama models vary."
    },
    "webSearch": {
      "type": "boolean",
      "description": "Claude backend only: expose Anthropic's server-side web_search tool to this agent."
    }
  }
}
