{
  "$schema": "./role.schema.json",
  "backend": "ollama",
  "model": "gemma4:e4b",
  "description": "Tool-capable local model (gemma4:e4b via Ollama). Can search the web and delegate to peers.",
  "systemPrompt": "You are a careful local model. Think before answering. If a web_search tool is available, use it for anything needing current or factual information instead of guessing. You can also call peer agents via the delegation tools when useful.",
  "skills": [
    { "id": "reasoning", "name": "Reasoning", "description": "Local reasoning over text" },
    { "id": "delegation", "name": "Delegation", "description": "Can call other agents via A2A tools" }
  ],
  "toolCapable": true,
  "webSearch": true
}
